{
  "schema": "evalgate.report.v1",
  "suite": "redaction.v1",
  "run_id": "redaction.v1-dev-20261017T000801Z",
  "created_at": "2026-10-17T00:08:01Z",
  "git_sha": "e92ace360e51da99e5b28fa5db5889b6da4d3a58",
  "mode": "offline",
  "models": [],
  "prompt_hashes": {
    "injection_detector": "a27d94e8612e26f9e9584587f5175c51e97d4ac466ce3468ea083e1e1e4bd457",
    "policy_bundle": "81993332a611147cc767b8b11b9748eb7a09b9a072accfee9b68c01cc9170e2c",
    "redaction_detector": "dd5e1b871be5ed4306866ca273051e19110c9a08d898243931747d2a33bfa9cc"
  },
  "n_cases": 72,
  "metrics": {
    "precision": {
      "value": 1,
      "threshold": 0.95,
      "direction": "higher",
      "passed": true,
      "ci_low": 1,
      "ci_high": 1
    },
    "recall": {
      "value": 1,
      "threshold": 0.98,
      "direction": "higher",
      "passed": true,
      "ci_low": 1,
      "ci_high": 1
    }
  },
  "cost_usd_total": 0,
  "cost_usd_per_case": 0,
  "latency_p50_ms": 0.029,
  "latency_p95_ms": 0.047,
  "cases": [
    {
      "id": "red-dev-001",
      "split": "dev",
      "scores": {
        "decoys_lost": 0,
        "markers": 3,
        "spans": 3,
        "spans_removed": 3,
        "true_markers": 3
      },
      "passed": true,
      "cost_usd": 0,
      "latency_ms": 0.075,
      "error": null
    },
    {
      "id": "red-dev-002",
      "split": "dev",
      "scores": {
        "decoys_lost": 0,
        "markers": 2,
        "spans": 2,
        "spans_removed": 2,
        "true_markers": 2
      },
      "passed": true,
      "cost_usd": 0,
      "latency_ms": 0.034,
      "error": null
    },
    {
      "id": "red-dev-003",
      "split": "dev",
      "scores": {
        "decoys_lost": 0,
        "markers": 3,
        "spans": 3,
        "spans_removed": 3,
        "true_markers": 3
      },
      "passed": true,
      "cost_usd": 0,
      "latency_ms": 0.041,
      "error": null
    },
    {
      "id": "red-dev-004",
      "split": "dev",
      "scores": {
        "decoys_lost": 1,
        "markers": 1,
        "spans": 1,
        "spans_removed": 1,
        "true_markers": 1
      },
      "passed": false,
      "cost_usd": 0,
      "latency_ms": 0.027,
      "error": null
    },
    {
      "id": "red-dev-005",
      "split": "dev",
      "scores": {
        "decoys_lost": 0,
        "markers": 2,
        "spans": 2,
        "spans_removed": 2,
        "true_markers": 2
      },
      "passed": true,
      "cost_usd": 0,
      "latency_ms": 0.033,
      "error": null
    },
    {
      "id": "red-dev-006",
      "split": "dev",
      "scores": {
        "decoys_lost": 0,
        "markers": 3,
        "spans": 3,
        "spans_removed": 3,
        "true_markers": 3
      },
      "passed": true,
      "cost_usd": 0,
      "latency_ms": 0.036,
      "error": null
    },
    {
      "id": "red-dev-007",
      "split": "dev",
      "scores": {
        "decoys_lost": 0,
        "markers": 1,
        "spans": 1,
        "spans_removed": 1,
        "true_markers": 1
      },
      "passed": true,
      "cost_usd": 0,
      "latency_ms": 0.027,
      "error": null
    },
    {
      "id": "red-dev-008",
      "split": "dev",
      "scores": {
        "decoys_lost": 1,
        "markers": 1,
        "spans": 1,
        "spans_removed": 1,
        "true_markers": 1
      },
      "passed": false,
      "cost_usd": 0,
      "latency_ms": 0.042,
      "error": null
    },
    {
      "id": "red-dev-009",
      "split": "dev",
      "scores": {
        "decoys_lost": 1,
        "markers": 3,
        "spans": 3,
        "spans_removed": 3,
        "true_markers": 3
      },
      "passed": false,
      "cost_usd": 0,
      "latency_ms": 0.04,
      "error": null
    },
    {
      "id": "red-dev-010",
      "split": "dev",
      "scores": {
        "decoys_lost": 0,
        "markers": 3,
        "spans": 3,
        "spans_removed": 3,
        "true_markers": 3
      },
      "passed": true,
      "cost_usd": 0,
      "latency_ms": 0.037,
      "error": null
    },
    {
      "id": "red-dev-011",
      "split": "dev",
      "scores": {
        "decoys_lost": 0,
        "markers": 2,
        "spans": 2,
        "spans_removed": 2,
        "true_markers": 2
      },
      "passed": true,
      "cost_usd": 0,
      "latency_ms": 0.03,
      "error": null
    },
    {
      "id": "red-dev-012",
      "split": "dev",
      "scores": {
        "decoys_lost": 0,
        "markers": 3,
        "spans": 3,
        "spans_removed": 3,
        "true_markers": 3
      },
      "passed": true,
      "cost_usd": 0,
      "latency_ms": 0.035,
      "error": null
    },
    {
      "id": "red-dev-013",
      "split": "dev",
      "scores": {
        "decoys_lost": 1,
        "markers": 2,
        "spans": 2,
        "spans_removed": 2,
        "true_markers": 2
      },
      "passed": false,
      "cost_usd": 0,
      "latency_ms": 0.029,
      "error": null
    },
    {
      "id": "red-dev-014",
      "split": "dev",
      "scores": {
        "decoys_lost": 0,
        "markers": 1,
        "spans": 1,
        "spans_removed": 1,
        "true_markers": 1
      },
      "passed": true,
      "cost_usd": 0,
      "latency_ms": 0.028,
      "error": null
    },
    {
      "id": "red-dev-015",
      "split": "dev",
      "scores": {
        "decoys_lost": 0,
        "markers": 1,
        "spans": 1,
        "spans_removed": 1,
        "true_markers": 1
      },
      "passed": true,
      "cost_usd": 0,
      "latency_ms": 0.024,
      "error": null
    },
    {
      "id": "red-dev-016",
      "split": "dev",
      "scores": {
        "decoys_lost": 0,
        "markers": 1,
        "spans": 1,
        "spans_removed": 1,
        "true_markers": 1
      },
      "passed": true,
      "cost_usd": 0,
      "latency_ms": 0.022,
      "error": null
    },
    {
      "id": "red-dev-017",
      "split": "dev",
      "scores": {
        "decoys_lost": 0,
        "markers": 2,
        "spans": 2,
        "spans_removed": 2,
        "true_markers": 2
      },
      "passed": true,
      "cost_usd": 0,
      "latency_ms": 0.033,
      "error": null
    },
    {
      "id": "red-dev-018",
      "split": "dev",
      "scores": {
        "decoys_lost": 0,
        "markers": 3,
        "spans": 3,
        "spans_removed": 3,
        "true_markers": 3
      },
      "passed": true,
      "cost_usd": 0,
      "latency_ms": 0.038,
      "error": null
    },
    {
      "id": "red-dev-019",
      "split": "dev",
      "scores": {
        "decoys_lost": 0,
        "markers": 3,
        "spans": 3,
        "spans_removed": 3,
        "true_markers": 3
      },
      "passed": true,
      "cost_usd": 0,
      "latency_ms": 0.034,
      "error": null
    },
    {
      "id": "red-dev-020",
      "split": "dev",
      "scores": {
        "decoys_lost": 0,
        "markers": 2,
        "spans": 2,
        "spans_removed": 2,
        "true_markers": 2
      },
      "passed": true,
      "cost_usd": 0,
      "latency_ms": 0.035,
      "error": null
    },
    {
      "id": "red-dev-021",
      "split": "dev",
      "scores": {
        "decoys_lost": 0,
        "markers": 1,
        "spans": 1,
        "spans_removed": 1,
        "true_markers": 1
      },
      "passed": true,
      "cost_usd": 0,
      "latency_ms": 0.046,
      "error": null
    },
    {
      "id": "red-dev-022",
      "split": "dev",
      "scores": {
        "decoys_lost": 0,
        "markers": 1,
        "spans": 1,
        "spans_removed": 1,
        "true_markers": 1
      },
      "passed": true,
      "cost_usd": 0,
      "latency_ms": 0.031,
      "error": null
    },
    {
      "id": "red-dev-023",
      "split": "dev",
      "scores": {
        "decoys_lost": 1,
        "markers": 3,
        "spans": 3,
        "spans_removed": 3,
        "true_markers": 3
      },
      "passed": false,
      "cost_usd": 0,
      "latency_ms": 0.036,
      "error": null
    },
    {
      "id": "red-dev-024",
      "split": "dev",
      "scores": {
        "decoys_lost": 1,
        "markers": 1,
        "spans": 1,
        "spans_removed": 1,
        "true_markers": 1
      },
      "passed": false,
      "cost_usd": 0,
      "latency_ms": 0.025,
      "error": null
    },
    {
      "id": "red-dev-025",
      "split": "dev",
      "scores": {
        "decoys_lost": 0,
        "markers": 2,
        "spans": 2,
        "spans_removed": 2,
        "true_markers": 2
      },
      "passed": true,
      "cost_usd": 0,
      "latency_ms": 0.028,
      "error": null
    },
    {
      "id": "red-dev-026",
      "split": "dev",
      "scores": {
        "decoys_lost": 0,
        "markers": 3,
        "spans": 3,
        "spans_removed": 3,
        "true_markers": 3
      },
      "passed": true,
      "cost_usd": 0,
      "latency_ms": 0.036,
      "error": null
    },
    {
      "id": "red-dev-027",
      "split": "dev",
      "scores": {
        "decoys_lost": 0,
        "markers": 2,
        "spans": 2,
        "spans_removed": 2,
        "true_markers": 2
      },
      "passed": true,
      "cost_usd": 0,
      "latency_ms": 0.028,
      "error": null
    },
    {
      "id": "red-dev-028",
      "split": "dev",
      "scores": {
        "decoys_lost": 0,
        "markers": 2,
        "spans": 2,
        "spans_removed": 2,
        "true_markers": 2
      },
      "passed": true,
      "cost_usd": 0,
      "latency_ms": 0.032,
      "error": null
    },
    {
      "id": "red-dev-029",
      "split": "dev",
      "scores": {
        "decoys_lost": 0,
        "markers": 2,
        "spans": 2,
        "spans_removed": 2,
        "true_markers": 2
      },
      "passed": true,
      "cost_usd": 0,
      "latency_ms": 0.073,
      "error": null
    },
    {
      "id": "red-dev-030",
      "split": "dev",
      "scores": {
        "decoys_lost": 0,
        "markers": 3,
        "spans": 3,
        "spans_removed": 3,
        "true_markers": 3
      },
      "passed": true,
      "cost_usd": 0,